<?xml version="1.0" encoding="utf-8"?>
<descriptor xmlns="http://www.rpath.com/permanent/descriptor-1.0.xsd" 
  xmlns:xsi="http://www.w3.org/2001/XMLSchema-instance" 
  xsi:schemaLocation="http://www.rpath.com/permanent/descriptor-1.0.xsd descriptor-1.0.xsd">
 <metadata>
   <displayName>EC2 Cloud Configuration</displayName>
   <descriptions>
     <desc>Configure Amazon EC2</desc>
   </descriptions>
 </metadata>
 <dataFields>
   <field>
     <name>name</name>
     <descriptions>
       <desc>Name</desc>
     </descriptions>
     <type>str</type>
     <default>aws</default>
     <hidden>true</hidden>
   </field>
   <field>
     <name>cloudAlias</name>
     <descriptions>
       <desc>Cloud Alias</desc>
     </descriptions>
     <type>str</type>
     <default>ec2</default>
     <hidden>true</hidden>
   </field>
   <field>
     <name>fullDescription</name>
     <descriptions>
       <desc>Full Description</desc>
     </descriptions>
     <type>str</type>
     <default>Amazon Elastic Compute Cloud</default>
     <hidden>true</hidden>
   </field>
   <field>
     <name>accountId</name>
     <descriptions>
       <desc>AWS Account Number</desc>
     </descriptions>
     <help href="https://rbanext-eng.eng.rpath.com/catalog/clouds/ec2/help/configuration/accountNumber.html"/>
     <type>str</type>
     <constraints>
       <descriptions>
         <desc>This field cannot be more than 12 characters in length</desc>
       </descriptions>
       <length>12</length>
     </constraints>
     <required>true</required>
   </field>
   <field>
     <name>publicAccessKeyId</name>
     <descriptions>
       <desc>Access Key ID</desc>
     </descriptions>
     <help href="https://rbanext-eng.eng.rpath.com/catalog/clouds/ec2/help/configuration/accessKey.html"/>
     <type>str</type>
     <constraints>
       <descriptions>
         <desc>This field cannot be more than 100 characters in length</desc>
       </descriptions>
       <length>100</length>
     </constraints>
     <required>true</required>
   </field>
   <field>
     <name>secretAccessKey</name>
     <descriptions>
       <desc>Secret Access Key</desc>
     </descriptions>
     <help href="https://rbanext-eng.eng.rpath.com/catalog/clouds/ec2/help/configuration/secretAccessKey.html"/>
     <type>str</type>
     <constraints>
       <descriptions>
         <desc>256 is all the characters this field can hold</desc>
       </descriptions>
       <length>256</length>
     </constraints>
     <required>true</required>
     <password>true</password>
   </field>
   <field>
     <name>certificateData</name>
     <descriptions>
       <desc>X.509 Certificate</desc>
     </descriptions>
     <help href="https://rbanext-eng.eng.rpath.com/catalog/clouds/ec2/help/configuration/certificateData.html"/>
     <type>str</type>
     <constraints>
       <descriptions>
         <desc>The certificate must start with '-----BEGIN CERTIFICATE-----', end with '-----END CERTIFICATE-----', and have a maximum length of 16384 characters.</desc>
       </descriptions>
       <regexp>^\s*-----BEGIN CERTIFICATE-----.*-----END CERTIFICATE-----\s*$</regexp>
       <length>16384</length>
     </constraints>
     <required>true</required>
     <allowFileContent>true
</allowFileContent>
   </field>
   <field>
     <name>certificateKeyData</name>
     <descriptions>
       <desc>X.509 Private Key</desc>
     </descriptions>
     <help href="https://rbanext-eng.eng.rpath.com/catalog/clouds/ec2/help/configuration/certificateKeyData.html"/>
     <type>str</type>
     <constraints>
       <descriptions>
         <desc>The key must start with '-----BEGIN PRIVATE KEY-----', end with '----END PRIVATE KEY-----', and have a maximum length of 16384 characters.</desc>
       </descriptions>
       <regexp>^\s*-----BEGIN (\S+ )?PRIVATE KEY-----.*-----END (\S+ )?PRIVATE KEY-----\s*$</regexp>
       <length>16384</length>
     </constraints>
     <required>true</required>
     <allowFileContent>true
</allowFileContent>
   </field>
   <field>
     <name>s3Bucket</name>
     <descriptions>
       <desc>S3 Bucket</desc>
     </descriptions>
     <help href="https://rbanext-eng.eng.rpath.com/catalog/clouds/ec2/help/configuration/s3Bucket.html"/>
     <type>str</type>
     <constraints>
       <descriptions>
         <desc>The S3 bucket name cannot be more than 32 characters long</desc>
       </descriptions>
       <length>32</length>
     </constraints>
     <required>true</required>
   </field>
 </dataFields>
</descriptor>
