<?xml version="1.0" encoding="utf-8"?>
<descriptor xmlns="http://www.rpath.com/permanent/descriptor-1.0.xsd" xmlns:xsi="http://www.w3.org/2001/XMLSchema-instance" xsi:schemaLocation="http://www.rpath.com/permanent/descriptor-1.0.xsd descriptor-1.0.xsd">
    <metadata>
    <displayName>
    Amazon EC2 Launch Parameters
    </displayName>
    <descriptions>
    <desc>
    Amazon EC2 Launch Parameters
    </desc>
    </descriptions>
    </metadata>
    <dataFields>
    <field>
    <name>
    imageId
    </name>
    <descriptions>
    <desc>
    Image ID
    </desc>
    </descriptions>
    <type>
    str
    </type>
    <constraints>
    <range>
    <min>
    1
    </min>
    <max>
    32
    </max>
    </range>
    </constraints>
    <required>
    true
    </required>
    <hidden>
    true
    </hidden>
    </field>
    <field>
    <name>
    instanceType
    </name>
    <descriptions>
    <desc>
    Instance Type
    </desc>
    <desc lang="fr_FR">
    Type de l'instance
    </desc>
    </descriptions>
    <help href="https://test154.rdu.rpath.com/catalog/clouds/ec2/help/launch/instanceTypes.html" />
    <enumeratedType>
    <describedValue>
    <descriptions>
    <desc>
    Small
    </desc>
    </descriptions>
    <key>
    m1.small
    </key>
    </describedValue>
    <describedValue>
    <descriptions>
    <desc>
    Large
    </desc>
    </descriptions>
    <key>
    m1.large
    </key>
    </describedValue>
    <describedValue>
    <descriptions>
    <desc>
    Extra Large
    </desc>
    </descriptions>
    <key>
    m1.xlarge
    </key>
    </describedValue>
    <describedValue>
    <descriptions>
    <desc>
    High-CPU Medium
    </desc>
    </descriptions>
    <key>
    c1.medium
    </key>
    </describedValue>
    <describedValue>
    <descriptions>
    <desc>
    High-CPU Extra Large
    </desc>
    </descriptions>
    <key>
    c1.xlarge
    </key>
    </describedValue>
    </enumeratedType>
    <default>
    m1.small
    </default>
    <required>
    true
    </required>
    </field>
    <field>
    <name>
    availabilityZone
    </name>
    <descriptions>
    <desc>
    Availability Zone
    </desc>
    <desc lang="fr_FR">
    Zone de disponibilit‚àö¬©
    </desc>
    </descriptions>
    <help href="https://test154.rdu.rpath.com/catalog/clouds/ec2/help/launch/availabilityZones.html" />
    <enumeratedType>
    <describedValue>
    <descriptions>
    <desc>
    us-east-1a
    </desc>
    </descriptions>
    <key>
    us-east-1a
    </key>
    </describedValue>
    <describedValue>
    <descriptions>
    <desc>
    us-east-1b
    </desc>
    </descriptions>
    <key>
    us-east-1b
    </key>
    </describedValue>
    <describedValue>
    <descriptions>
    <desc>
    us-east-1c
    </desc>
    </descriptions>
    <key>
    us-east-1c
    </key>
    </describedValue>
    <describedValue>
    <descriptions>
    <desc>
    us-east-1d
    </desc>
    </descriptions>
    <key>
    us-east-1d
    </key>
    </describedValue>
    </enumeratedType>
    </field>
    <field>
    <name>
    minCount
    </name>
    <descriptions>
    <desc>
    Minimum Number of Instances
    </desc>
    <desc lang="fr_FR">
    Nombre minimal d'instances
    </desc>
    </descriptions>
    <help href="https://test154.rdu.rpath.com/catalog/clouds/ec2/help/launch/minInstances.html" />
    <type>
    int
    </type>
    <default>
    1
    </default>
    <constraints>
    <range>
    <min>
    1
    </min>
    <max>
    100
    </max>
    </range>
    </constraints>
    <required>
    true
    </required>
    </field>
    <field>
    <name>
    maxCount
    </name>
    <descriptions>
    <desc>
    Maximum Number of Instances
    </desc>
    <desc lang="fr_FR">
    Nombre maximal d'instances
    </desc>
    </descriptions>
    <help href="https://test154.rdu.rpath.com/catalog/clouds/ec2/help/launch/maxInstances.html" />
    <type>
    int
    </type>
    <default>
    1
    </default>
    <constraints>
    <range>
    <min>
    1
    </min>
    <max>
    100
    </max>
    </range>
    </constraints>
    <required>
    true
    </required>
    </field>
    <field>
    <name>
    keyName
    </name>
    <descriptions>
    <desc>
    SSH Key Pair
    </desc>
    <desc lang="fr_FR">
    Paire de clefs
    </desc>
    </descriptions>
    <help href="https://test154.rdu.rpath.com/catalog/clouds/ec2/help/launch/keyPair.html" />
    <enumeratedType>
    <describedValue>
    <descriptions>
    <desc>
    Og-QA
    </desc>
    </descriptions>
    <key>
    Og-QA
    </key>
    </describedValue>
    <describedValue>
    <descriptions>
    <desc>
    qauser
    </desc>
    </descriptions>
    <key>
    qauser
    </key>
    </describedValue>
    </enumeratedType>
    </field>
    <field>
    <name>
    securityGroups
    </name>
    <descriptions>
    <desc>
    Security Groups
    </desc>
    <desc lang="fr_FR">
    Groupes de s‚àö¬©curit‚àö¬©
    </desc>
    </descriptions>
    <help href="https://test154.rdu.rpath.com/catalog/clouds/ec2/help/launch/securityGroups.html" />
    <enumeratedType>
    <describedValue>
    <descriptions>
    <desc>
    Default EC2 Catalog Security Group
    </desc>
    </descriptions>
    <key>
    catalog-default
    </key>
    </describedValue>
    <describedValue>
    <descriptions>
    <desc>
    Generated Security Group
    </desc>
    </descriptions>
    <key>
    dynamic
    </key>
    </describedValue>
    <describedValue>
    <descriptions>
    <desc>
    Wide open
    </desc>
    </descriptions>
    <key>
    all to all
    </key>
    </describedValue>
    <describedValue>
    <descriptions>
    <desc>
    default group
    </desc>
    </descriptions>
    <key>
    default
    </key>
    </describedValue>
    </enumeratedType>
    <multiple>
    true
    </multiple>
    <default>
    catalog-default
    </default>
    <required>
    true
    </required>
    </field>
    <field>
    <name>
    remoteIp
    </name>
    <descriptions>
    <desc>
    Remote IP address allowed to connect (if security group is catalog-default)
    </desc>
    </descriptions>
    <type>
    str
    </type>
    <constraints>
    <length>
    128
    </length>
    </constraints>
    <hidden>
    true
    </hidden>
    </field>
    <field>
    <name>
    userData
    </name>
    <descriptions>
    <desc>
    User Data
    </desc>
    <desc lang="fr_FR">
    Data utilisateur
    </desc>
    </descriptions>
    <help href="https://test154.rdu.rpath.com/catalog/clouds/ec2/help/launch/userData.html" />
    <type>
    str
    </type>
    <constraints>
    <length>
    256
    </length>
    </constraints>
    </field>
    </dataFields>
    </descriptor>